{
  "schemaVersion": "1.1.0",
  "packId": "READINESS-PACK-KAP-OPERATIONAL-CANDIDATE-2026-v1",
  "projectId": "PROJECT-KAP-OPENING-2026",
  "eventId": "EVENT-KAP-OPENING-2026",
  "venueId": "VENUE-KAP-001",
  "generatedAt": "2026-07-29T16:06:13+03:00",
  "sourceFingerprint": "9bc85024e3d1d8707518582607d1200560e4d64d0d5ef4902f01d971c6301f97",
  "sourceTraceFingerprint": "900cd8a205b170e4893fb2a938a98628925a504dfb13b20ee045131b3f7d5530",
  "extractionFingerprint": "f675a2e608690274aff804dd005b9acb8960d293c89db24e62d0044e47798813",
  "sources": [
    {
      "sourceId": "SOURCE-ASSET-KAP-GOVERNANCE-PPTX-001",
      "originalFilename": "حوكمة_مشروع_حدائق_الملك_عبدالله_  05-07-2026 (3).pptx",
      "absoluteLocalPath": "local-review://SOURCE-ASSET-KAP-GOVERNANCE-PPTX-001/R1",
      "expectedByteSize": 6403790,
      "observedByteSize": 6403790,
      "expectedSha256": "8b45cff4b505d5e1b08088c84426d46895d4cb127580e2c388a655cc44bf63fb",
      "observedSha256": "8b45cff4b505d5e1b08088c84426d46895d4cb127580e2c388a655cc44bf63fb",
      "fingerprintStatus": "verified",
      "sourceClassification": "founder-approved-project-governance-source",
      "approvalScope": "مرجع حوكمة مشروع مؤسس لمسارات العمل والأدوار والتسليمات والتصعيد.",
      "approvalLimitations": [
        "لا يثبت إنجازًا ميدانيًا أو جاهزية تشغيلية.",
        "اعتماد التسليمات لا يساوي اعتماد HSE أو قرار افتتاح.",
        "لا تُستنتج سلطة إنتاج من ظهور اسم فقط."
      ],
      "extractedAt": "2026-07-29T16:06:13+03:00",
      "extractionTool": "deterministic-pptx-zip-xml-extractor",
      "extractionToolVersion": "stage3g1a-v1",
      "supersedesSourceId": null,
      "sourceRevision": 1,
      "supersedesSourceRevisionId": null,
      "previousSourceHash": null,
      "committedBinary": false,
      "sourceRevisionId": "SOURCE-ASSET-KAP-GOVERNANCE-PPTX-001:R1:8B45CFF4B505D5E1"
    },
    {
      "sourceId": "SOURCE-ASSET-KAP-DWG-LOCAL-001",
      "originalFilename": "Kaig-master 2.dwg",
      "absoluteLocalPath": "local-review://SOURCE-ASSET-KAP-DWG-LOCAL-001/R1",
      "expectedByteSize": 99452545,
      "observedByteSize": 99452545,
      "expectedSha256": "a96a455b83f3ee538af81bfed69d61300a0eca20fda699ae634f967467b33a2d",
      "observedSha256": "a96a455b83f3ee538af81bfed69d61300a0eca20fda699ae634f967467b33a2d",
      "fingerprintStatus": "verified",
      "sourceClassification": "founder-approved-cad-source",
      "approvalScope": "مصدر CAD عامل معتمد من المؤسس للمراجعة والتحويل المستقبلي.",
      "approvalLimitations": [
        "ليس هندسة مساحية أو خط أساس هندسيًا معتمدًا.",
        "لا يثبت المقياس أو CRS أو الشمال أو نقطة الأصل أو نقاط الضبط.",
        "لا يثبت مسارًا أو سعة أو حالة تشغيل."
      ],
      "extractedAt": "2026-07-29T16:06:13+03:00",
      "extractionTool": "sha256-and-file-signature-verifier",
      "extractionToolVersion": "stage3g1a-v1",
      "supersedesSourceId": "SOURCE-ASSET-KAP-DWG-DRIVE-001",
      "sourceRevision": 1,
      "supersedesSourceRevisionId": null,
      "previousSourceHash": null,
      "committedBinary": false,
      "sourceRevisionId": "SOURCE-ASSET-KAP-DWG-LOCAL-001:R1:A96A455B83F3EE53"
    },
    {
      "sourceId": "SOURCE-ASSET-KAP-EMPLOYEE-XLSX-001",
      "originalFilename": "اسماء موظفين ميادين .xlsx",
      "absoluteLocalPath": "local-review://SOURCE-ASSET-KAP-EMPLOYEE-XLSX-001/R1",
      "expectedByteSize": 15661,
      "observedByteSize": 15661,
      "expectedSha256": "fac606e4517e8d6e2f070dab4582d980b932c8eca2d9f5a0f3ea0fb18a746aec",
      "observedSha256": "fac606e4517e8d6e2f070dab4582d980b932c8eca2d9f5a0f3ea0fb18a746aec",
      "fingerprintStatus": "verified",
      "sourceClassification": "employee-name-reference-limited",
      "approvalScope": "مطابقة الاسم والمسمى الوظيفي العربيين في الصف المصرح فقط.",
      "approvalLimitations": [
        "لا يثبت تعيينًا في المشروع.",
        "لا يثبت ملكية متطلب أو سلطة تحقق أو اعتماد.",
        "لا تُستخرج بيانات اتصال أو صفوف موظفين أخرى."
      ],
      "extractedAt": "2026-07-29T16:06:13+03:00",
      "extractionTool": "deterministic-xlsx-approved-field-extractor",
      "extractionToolVersion": "stage3g1a-v1",
      "supersedesSourceId": null,
      "sourceRevision": 1,
      "supersedesSourceRevisionId": null,
      "previousSourceHash": null,
      "committedBinary": false,
      "sourceRevisionId": "SOURCE-ASSET-KAP-EMPLOYEE-XLSX-001:R1:FAC606E4517E8D6E"
    },
    {
      "sourceId": "SOURCE-ASSET-STAGE3G1-FOUNDER-DIRECTION-001",
      "originalFilename": "pasted-text.txt",
      "absoluteLocalPath": "local-review://SOURCE-ASSET-STAGE3G1-FOUNDER-DIRECTION-001/R1",
      "expectedByteSize": 29659,
      "observedByteSize": 29659,
      "expectedSha256": "b74fcd1eee9d5c38044ee0bae3ea8868b79a5018924dcb9e6b41296788a49bd5",
      "observedSha256": "b74fcd1eee9d5c38044ee0bae3ea8868b79a5018924dcb9e6b41296788a49bd5",
      "fingerprintStatus": "verified",
      "sourceClassification": "founder-direction",
      "approvalScope": "توجيه مؤسس صريح لنطاق Stage 3G.1 وللممثلين المذكورين وحدود السلطة.",
      "approvalLimitations": [
        "لا يمنح اعتماد عميل أو هندسة أو HSE أو مسارات أو افتتاح.",
        "لا يثبت جاهزية KAP أو اكتمال أي متطلب ميداني."
      ],
      "extractedAt": "2026-07-29T16:06:13+03:00",
      "extractionTool": "plain-text-directive-verifier",
      "extractionToolVersion": "stage3g1a-v1",
      "supersedesSourceId": null,
      "sourceRevision": 1,
      "supersedesSourceRevisionId": null,
      "previousSourceHash": null,
      "committedBinary": false,
      "sourceRevisionId": "SOURCE-ASSET-STAGE3G1-FOUNDER-DIRECTION-001:R1:B74FCD1EEE9D5C38"
    }
  ],
  "sourceTraces": [
    {
      "traceId": "TRACE-KAP-CAD-FINGERPRINT",
      "locatorType": "file-fingerprint",
      "slideNumber": null,
      "sheetName": null,
      "rowNumber": null,
      "tableIndex": null,
      "shapeId": null,
      "sectionReference": "AC1032 / AutoCAD 2018 DWG family",
      "sanitizedSourceLabel": "مصدر CAD العامل",
      "extractedMeaning": "تطابقت البصمة والحجم؛ المصدر عامل وغير مساحي ولا يمثل هندسة معتمدة.",
      "extractionConfidence": "high",
      "reviewStatus": "founder-approved-source",
      "sourceId": "SOURCE-ASSET-KAP-DWG-LOCAL-001",
      "sourceRevision": 1,
      "sourceHash": "a96a455b83f3ee538af81bfed69d61300a0eca20fda699ae634f967467b33a2d"
    },
    {
      "traceId": "TRACE-KAP-EMPLOYEE-FINGERPRINT",
      "locatorType": "file-fingerprint",
      "slideNumber": null,
      "sheetName": null,
      "rowNumber": null,
      "tableIndex": null,
      "shapeId": null,
      "sectionReference": "A1:E67; approved extraction B28,D28 only",
      "sanitizedSourceLabel": "مرجع أسماء الموظفين",
      "extractedMeaning": "تطابقت البصمة واقتصر الاستخراج على حقلي الاسم والمسمى العربيين في الصف المصرح.",
      "extractionConfidence": "high",
      "reviewStatus": "reviewed",
      "sourceId": "SOURCE-ASSET-KAP-EMPLOYEE-XLSX-001",
      "sourceRevision": 1,
      "sourceHash": "fac606e4517e8d6e2f070dab4582d980b932c8eca2d9f5a0f3ea0fb18a746aec"
    },
    {
      "traceId": "TRACE-KAP-EMPLOYEE-MUHAMMAD-R28",
      "locatorType": "workbook-row",
      "slideNumber": null,
      "sheetName": "موظفين ميادين",
      "rowNumber": 28,
      "tableIndex": null,
      "shapeId": null,
      "sectionReference": "columns B,D only",
      "sanitizedSourceLabel": "مطابقة موظف محدد",
      "extractedMeaning": "يطابق المصدر اسم محمد إبراهيم ويعرض المسمى الوظيفي عامل مكتب؛ لا يثبت دورًا أو سلطة في المشروع.",
      "extractionConfidence": "high",
      "reviewStatus": "reviewed",
      "sourceId": "SOURCE-ASSET-KAP-EMPLOYEE-XLSX-001",
      "sourceRevision": 1,
      "sourceHash": "fac606e4517e8d6e2f070dab4582d980b932c8eca2d9f5a0f3ea0fb18a746aec"
    },
    {
      "traceId": "TRACE-KAP-FOUNDER-AHMED-LIMITS",
      "locatorType": "founder-direction",
      "slideNumber": null,
      "sheetName": null,
      "rowNumber": null,
      "tableIndex": null,
      "shapeId": null,
      "sectionReference": "founder-authority-boundary",
      "sanitizedSourceLabel": "حدود سلطة المؤسس",
      "extractedMeaning": "أحمد سلطة رؤية وقبول للمنصة فقط، وليس تلقائيًا سلطة عميل أو هندسة أو HSE أو مسارات أو افتتاح.",
      "extractionConfidence": "high",
      "reviewStatus": "founder-approved-source",
      "sourceId": "SOURCE-ASSET-STAGE3G1-FOUNDER-DIRECTION-001",
      "sourceRevision": 1,
      "sourceHash": "b74fcd1eee9d5c38044ee0bae3ea8868b79a5018924dcb9e6b41296788a49bd5"
    },
    {
      "traceId": "TRACE-KAP-FOUNDER-IBRAHIM",
      "locatorType": "founder-direction",
      "slideNumber": null,
      "sheetName": null,
      "rowNumber": null,
      "tableIndex": null,
      "shapeId": null,
      "sectionReference": "explicit-founder-provided-project-actors/ibrahim-al-ghamri",
      "sanitizedSourceLabel": "توجيه المؤسس",
      "extractedMeaning": "وجّه أحمد بتسجيل إبراهيم الغمري للمحتوى الإبداعي.",
      "extractionConfidence": "high",
      "reviewStatus": "founder-approved-source",
      "sourceId": "SOURCE-ASSET-STAGE3G1-FOUNDER-DIRECTION-001",
      "sourceRevision": 1,
      "sourceHash": "b74fcd1eee9d5c38044ee0bae3ea8868b79a5018924dcb9e6b41296788a49bd5"
    },
    {
      "traceId": "TRACE-KAP-FOUNDER-MAJED",
      "locatorType": "founder-direction",
      "slideNumber": null,
      "sheetName": null,
      "rowNumber": null,
      "tableIndex": null,
      "shapeId": null,
      "sectionReference": "explicit-founder-provided-project-actors/majed-qasim",
      "sanitizedSourceLabel": "توجيه المؤسس",
      "extractedMeaning": "وجّه أحمد بتسجيل ماجد قاسم لمسار التشغيل.",
      "extractionConfidence": "high",
      "reviewStatus": "founder-approved-source",
      "sourceId": "SOURCE-ASSET-STAGE3G1-FOUNDER-DIRECTION-001",
      "sourceRevision": 1,
      "sourceHash": "b74fcd1eee9d5c38044ee0bae3ea8868b79a5018924dcb9e6b41296788a49bd5"
    },
    {
      "traceId": "TRACE-KAP-FOUNDER-MUHAMMAD",
      "locatorType": "founder-direction",
      "slideNumber": null,